owner_canonical,rows,n_variants,sample_variants
Pioneer Grain Co. Ltd..... Sask. Co-operative Elevator Co. Ltd..... British America Elevator Co. Ltd,1,1,"Pioneer Grain Co., Ltd..... Sask. Co-operative Elevator Co., Ltd..... British America Elevator Co., Ltd"
Sask. Co-operative Elevator Co. Ltd..... State Elevator Co. Ltd..... Sask. & Western Grain Co. Ltd,1,1,"Sask. Co-operative Elevator Co., Ltd..... State Elevator Co., Ltd..... Sask. & Western Grain Co., Ltd"
Central Grain Co. Ltd..... Searle Grain Co. Ltd..... United Grain Growers Ltd,1,1,"Central Grain Co., Ltd..... Searle Grain Co., Ltd..... United Grain Growers, Ltd"
Canada West Grain Co. Ltd..... Sask. Co-operative Elevator Co. Ltd..... McCabe Bros. Co..... *State Elevator Co. Ltd..... Canadian Elevator Co. Ltd,1,1,"Canada West Grain Co., Ltd..... Sask. Co-operative Elevator Co., Ltd..... McCabe Bros. Co..... *State Elevator Co., Ltd..... Canadian Elevator Co., Ltd"
Sask. Co-operative Elevator Co. Ltd..... Sask. & Western Grain Co. Ltd..... McLaughlin Elevator Co. Ltd..... Federal Grain Co. Ltd..... Province Elevator Co. Ltd,1,1,"Sask. Co-operative Elevator Co., Ltd..... Sask. & Western Grain Co., Ltd..... McLaughlin Elevator Co., Ltd..... Federal Grain Co., Ltd..... Province Elevator Co., Ltd"
McLaughlin Elevator Co. Ltd..... Sask. Co-operative Elevator Co. Ltd..... Brooks Elevator Co. Ltd,1,1,"McLaughlin Elevator Co., Ltd..... Sask. Co-operative Elevator Co., Ltd..... Brooks Elevator Co., Ltd"
Sask. Elevator Co. Ltd..... Sask. Co-operative Elevator Co. Ltd..... British America Elevator Co. Ltd,1,1,"Sask. Elevator Co., Ltd..... Sask. Co-operative Elevator Co., Ltd..... British America Elevator Co., Ltd"
Quaker Oats Co..... National Elevator Co. Ltd,1,1,"Quaker Oats Company..... National Elevator Co., Ltd"
Sask. Co-operative Elevator Co. Ltd..... North Star Grain Co. Ltd,1,1,"Sask. Co-operative Elevator Co., Ltd..... North Star Grain Co., Ltd"
Province Elevator Co. Ltd..... Brooks Elevator Co. Ltd,1,1,"Province Elevator Co., Ltd..... Brooks Elevator Co., Ltd"
British America Elevator Co. Ltd..... Sask. Elevator Co. Ltd..... Brooks Elevator Co. Ltd,1,1,"British America Elevator Co., Ltd..... Sask. Elevator Co., Ltd..... Brooks Elevator Co., Ltd"
N. Bawlf Grain Co. Ltd..... National Elevator Co. Ltd..... Victoria Elevator Co. Ltd..... Sask. Elevator Co. Ltd..... British America Elevator Co. Ltd..... Alberta Pacific Grain Co. Ltd,1,1,"N. Bawlf Grain Co., Ltd..... National Elevator Co., Ltd..... Victoria Elevator Co., Ltd..... Sask. Elevator Co., Ltd..... British America Elevator Co., Ltd..... Alberta Pacific Grain Co., Ltd"
Sask. Co-operative Elevator Co. Ltd..... Spencer Grain Co. Ltd..... North Star Grain Co. Ltd,1,1,"Sask. Co-operative Elevator Co., Ltd..... Spencer Grain Co., Ltd..... North Star Grain Co., Ltd"
National Elevator Co. Ltd..... British America Elevator Co. Ltd..... Sask. Elevator Co. Ltd..... United Grain Growers Ltd,1,1,"National Elevator Co., Ltd..... British America Elevator Co., Ltd..... Sask. Elevator Co., Ltd..... United Grain Growers, Ltd"
Liberty Grain Co. Ltd..... Sask. Elevator Co. Ltd..... Alberta Pacific Grain Co. Ltd,1,1,"Liberty Grain Co., Ltd..... Sask. Elevator Co., Ltd..... Alberta Pacific Grain Co., Ltd"
Sask. Co-operative Elevator Co. Ltd..... Canadian Elevator Co. Ltd,1,1,"Sask. Co-operative Elevator Co., Ltd..... Canadian Elevator Co., Ltd"
Alberta Pacific Grain Co. Ltd..... Searle Grain Co. Ltd..... British America Elevator Co. Ltd,1,1,"Alberta Pacific Grain Co., Ltd..... Searle Grain Co., Ltd..... British America Elevator Co., Ltd"
Sask. Co-operative Elevator Co. Ltd..... Pioneer Grain Co. Ltd..... British America Elevator Co. Ltd,1,1,"Sask. Co-operative Elevator Co., Ltd..... Pioneer Grain Co., Ltd..... British America Elevator Co., Ltd"
Hudson Bay Co Ltd,1,1,"*Hudson Bay Company, Ltd"
Scottish Co-operative Whsl. Soc. Ltd,1,1,"Scottish Co-operative Whsl. Soc., Ltd"
Scottish Co-operative Wholseale Soc. Ltd,1,1,"Scottish Co-operative Wholseale Soc., Ltd"
Scottish Co-operative Whsls. Soc. Ltd,1,1,"Scottish Co-operative Whsls. Soc., Ltd"
● Alberta Pacific Grain Co. Ltd,1,1,"● Alberta Pacific Grain Co., Ltd"
Crown Feed & Grain Co.—Mfg. E,1,1,Crown Feed & Grain Co.—Mfg. E
Parrish & Heimbacker Ltd,1,1,"*Parrish & Heimbacker, Ltd"
Alberta Linseed Oil Co. Ltd (Mfg. E.),1,1,"Alberta Linseed Oil Co., Ltd (Mfg. E.)"
George Lane & Co,1,1,*George Lane & Company
W. O. & R. H. Finkbine,1,1,W. O. & R. H. Finkbine
B. J. Ostrander Estate,1,1,*B. J. Ostrander Estate
United Growers Grain Ltd,1,1,"United Growers Grain, Ltd"
Topper Train Co. Ltd,1,1,"Topper Train Co., Ltd"
Burrard Elevator Co. Ltd,1,1,"Burrard Elevator Co., Ltd"
Westminster Grain Co,1,1,*Westminster Grain Company
Vancouver Harbour Commission No. 1,1,1,Vancouver Harbour Commission No. 1
Vancouver Harbour Commission No. 2,1,1,Vancouver Harbour Commission No. 2
"Canadian Pacific Rly. Co. ""A"" & ""C",1,1,"Canadian Pacific Rly. Co. ""A"" & ""C"""
Sask. Co-oper. Elevator Co. Ltd. No. 1,1,1,"*Sask. Co-oper. Elevator Co., Ltd., No. 1"
Canadian National Ry. Co,1,1,*Canadian National Ry. Co
Sask. Co-operative Elev. Co. Ltd. No. 3,1,1,"Sask. Co-operative Elev. Co., Ltd., No. 3"
Walter Clifford,1,1,Walter Clifford
E. S. The McLaughlin Elev. Co. Ltd,1,1,"E. S. The McLaughlin Elev. Co., Ltd"
Scottish Co-operative Wh's'le Soc. Ltd,1,1,"Scottish Co-operative Wh's'le Soc., Ltd"
Sask. Pool Elevators Ltd..... Central Grain Co. Ltd..... Dominion Elevator Co. Ltd..... Canadian Elevator Co. Ltd,1,1,"Sask. Pool Elevators, Ltd..... Central Grain Co., Ltd..... Dominion Elevator Co., Ltd..... Canadian Elevator Co., Ltd"
National Elevator Co. Ltd..... Northern Elevator Co. Ltd..... Sask. Pool Elevators Ltd..... Maple Leaf Milling Co. Ltd,1,1,"National Elevator Co., Ltd..... Northern Elevator Co., Ltd..... Sask. Pool Elevators, Ltd..... Maple Leaf Milling Co., Ltd"
Sask. Pool Elevators Ltd..... Maple Leaf Milling Co. Ltd..... Stewart Grain Co. Ltd..... Central Grain Co. Ltd,1,1,"Sask. Pool Elevators, Ltd..... Maple Leaf Milling Co., Ltd..... Stewart Grain Co., Ltd..... Central Grain Co., Ltd"
Sask. Pool Elevators Ltd..... Beaver Elevator Co. Ltd..... North Star Grain Co. Ltd..... The Alberta Pacific Grain Co. Ltd,1,1,"Sask. Pool Elevators, Ltd..... Beaver Elevator Co., Ltd..... North Star Grain Co., Ltd..... The Alberta Pacific Grain Co., Ltd"
Sask. Pool Elevators Ltd..... International Elevator Co. Ltd..... Matheson Lindsay Grain Co. Ltd..... Ogilvie Flour Mills Co. Ltd..... McCabe Bros. Co,1,1,"Sask. Pool Elevators, Ltd..... International Elevator Co., Ltd..... Matheson Lindsay Grain Co., Ltd..... Ogilvie Flour Mills Co., Ltd..... McCabe Bros. Company"
Sask. Pool Elevators Ltd..... The Alberta Pacific Grain Co. Ltd..... N. M. Paterson & Co. Ltd,1,1,"Sask. Pool Elevators, Ltd..... The Alberta Pacific Grain Co., Ltd..... N. M. Paterson & Co., Ltd"
Sask. Pool Elevators Ltd..... McCabe Bros. Co,1,1,"Sask. Pool Elevators, Ltd..... McCabe Bros. Company"
Grenfell Mfg. Elev. Co,1,1,*Grenfell Mfg. Elev. Co
Oxbow Frs. Elevator & Tdg. Co. Ltd,1,1,"Oxbow Frs. Elevator & Tdg. Co., Ltd"
Malden Elevator Co.,1,1,"Malden Elevator Co.,"
W. A. McHugh,1,1,W. A. McHugh
Province Elevator Co. Ltd. No. 1,1,1,"Province Elevator Co., Ltd., No. 1"
Province Elevator Co. Ltd. No. 2,1,1,"Province Elevator Co., Ltd., No. 2"
"Welwyn Farmers' Elevator Co. Ltd. ""A",1,1,"Welwyn Farmers' Elevator Co., Ltd., ""A"""
"Welwyn Farmers' Elevator Co. Ltd. ""B",1,1,"Welwyn Farmers' Elevator Co., Ltd., ""B"""
Security Elevator Co Ltd,1,1,*Security Elevator Co Ltd
Mfg. E. —Bishop Milling Co,1,1,Mfg. E. —Bishop Milling Co
Western Pool Elevator Co. Ltd,1,1,"Western Pool Elevator Co., Ltd"
Brooksby Elevator Co. (A Dunn),1,1,"Brooksby Elevator Co., (A Dunn)"
Robin Hood Mill Ltd,1,1,"Robin Hood Mill, Ltd"
Brooks Elevators Co. Ltd,1,1,"Brooks Elevators Co., Ltd"
Victoria Elevator Elevator Co. Ltd,1,1,"Victoria Elevator Elevator Co., Ltd"
Security Elevator Co.,1,1,"Security Elevator Co.,"
Scottish Co-operative Whse. Soc. Ltd,1,1,"Scottish Co-operative, Whse. Soc. Ltd"
Sask. Elevators Co. Ltd,1,1,"Sask. Elevators Co., Ltd"
Fédéral Grain Co. Ltd,1,1,"Fédéral Grain Co., Ltd"
Crown Feed & Grain Co—Mfg. E,1,1,Crown Feed & Grain Co—Mfg. E
Parish & Heimbecker Ltd,1,1,"Parish & Heimbecker, Ltd"
E. A. Mantz,1,1,E. A. Mantz
φAlberta Pool Elevators Ltd..... Federal Grain Co. Ltd..... The Alberta Pacific Grain Co. Ltd..... Midland Grain Co. Ltd..... Pioneer Grain Co. Ltd,1,1,"φAlberta Pool Elevators, Ltd..... Federal Grain Co., Ltd..... The Alberta Pacific Grain Co., Ltd..... Midland Grain Co., Ltd..... Pioneer Grain Co., Ltd"
National Elevator Co. Ltd..... United Grain Growers Ltd..... The Alberta Pacific Grain Co. Ltd..... Pioneer Grain Co. Ltd..... North Star Grain Co. Ltd..... W. O. & R. H. Finkbine,1,1,"National Elevator Co., Ltd..... United Grain Growers, Ltd..... The Alberta Pacific Grain Co., Ltd..... Pioneer Grain Co., Ltd..... North Star Grain Co., Ltd..... W. O. & R. H. Finkbine"
φAlberta Pool Elevators Ltd..... National Elevator Co. Ltd..... The Alberta Pacific Grain Co. Ltd,1,1,"φAlberta Pool Elevators, Ltd..... National Elevator Co., Ltd..... The Alberta Pacific Grain Co., Ltd"
United Grain Growers Ltd..... The Alberta Pacific Grain Co. Ltd..... Midland Grain Co. Ltd..... Province Elevator Co. Ltd,1,1,"United Grain Growers, Ltd..... The Alberta Pacific Grain Co., Ltd..... Midland Grain Co., Ltd..... Province Elevator Co., Ltd"
Raley Colony..... N. Bawlf Grain Co. Ltd..... The Alberta Pacific Grain Co. Ltd,1,1,"*Raley Colony..... N. Bawlf Grain Co., Ltd..... The Alberta Pacific Grain Co., Ltd"
Parrish & Heimbecker Ltd..... Ellison Milling & Elevator Co. Ltd..... United Grain Growers Ltd,1,1,"Parrish & Heimbecker, Ltd..... Ellison Milling & Elevator Co., Ltd..... United Grain Growers, Ltd"
Blades Brothers..... United Grain Growers Ltd..... The Alberta Pacific Grain Co. Ltd,1,1,"Blades Brothers..... United Grain Growers, Ltd..... The Alberta Pacific Grain Co., Ltd"
Ogilvie Flour Mills Co. Ltd..... Lake of the Woods Milling Co. Ltd..... Topper Grain Co. Ltd,1,1,"Ogilvie Flour Mills Co., Ltd..... Lake of the Woods Milling Co., Ltd..... Topper Grain Co., Ltd"
N. Bawlf Grain Co. Ltd..... United Grain Growers Ltd..... The Alberta Pacific Grain Co. Ltd..... Home Grain Co. Ltd..... Pioneer Grain Co. Ltd,1,1,"N. Bawlf Grain Co., Ltd..... United Grain Growers, Ltd..... The Alberta Pacific Grain Co., Ltd..... Home Grain Co., Ltd..... Pioneer Grain Co., Ltd"
N. Bawlf Grain Co. Ltd..... The Alberta Pacific Grain Co. Ltd,1,1,"N. Bawlf Grain Co., Ltd..... The Alberta Pacific Grain Co., Ltd"
Security Elevator Co. Ltd..... Ogilvie Flour Mills Co. Ltd,1,1,"Security Elevator Co., Ltd..... Ogilvie Flour Mills Co., Ltd"
Security Elevator Co. Ltd..... The Alberta Pacific Grain Co. Ltd,1,1,"Security Elevator Co., Ltd..... The Alberta Pacific Grain Co., Ltd"
W. A. Krause..... Gillespie Grain Co. Ltd..... The Alberta Pacific Grain Co. Ltd,1,1,"W. A. Krause..... Gillespie Grain Co., Ltd..... The Alberta Pacific Grain Co., Ltd"
Home Grain Co. Ltd..... United Grain Growers Ltd,1,1,"Home Grain Co., Ltd..... United Grain Growers, Ltd"
Gillespie Grain Co. Ltd..... Home Grain Co. Ltd,1,1,"Gillespie Grain Co., Ltd..... Home Grain Co., Ltd"
United Grain Growers Ltd..... *National Elevator Co. Ltd..... The Alberta Pacific Grain Co. Ltd..... Home Grain Co. Ltd,1,1,"United Grain Growers, Ltd..... *National Elevator Co., Ltd..... The Alberta Pacific Grain Co., Ltd..... Home Grain Co., Ltd"
Security Elevator Co. Ltd..... United Grain Growers Ltd..... Federal Grain Co. Ltd,1,1,"Security Elevator Co., Ltd..... United Grain Growers, Ltd..... Federal Grain Co., Ltd"
United Grain Growers Ltd..... National Elevator Co. Ltd..... Western Canada Flour Mills Co. Ltd..... The Alberta Pacific Grain Co. Ltd..... Pioneer Grain Co. Ltd,1,1,"United Grain Growers, Ltd..... National Elevator Co., Ltd..... Western Canada Flour Mills Co., Ltd..... The Alberta Pacific Grain Co., Ltd..... Pioneer Grain Co., Ltd"
Federal Grain Co. Ltd..... United Grain Growers Ltd..... Gillespie Grain Co. Ltd..... Fraser Grain Co. Ltd..... National Elevator Co. Ltd,1,1,"Federal Grain Co., Ltd..... United Grain Growers, Ltd..... Gillespie Grain Co., Ltd..... Fraser Grain Co., Ltd..... National Elevator Co., Ltd"
Edmonton Grain and Hay Co. Ltd,1,1,"*Edmonton Grain and Hay Co., Ltd"
\phi Alberta Pool Elevators Ltd..... The Alberta Pacific Grain Co. Ltd,1,1,"\phi Alberta Pool Elevators, Ltd..... The Alberta Pacific Grain Co., Ltd"
N. Bawlf Grain Co. Ltd..... United Grain Growers Ltd..... North Star Grain Co. Ltd,1,1,"N. Bawlf Grain Co., Ltd..... United Grain Growers, Ltd..... North Star Grain Co., Ltd"
United Grain Growers Ltd..... Home Grain Co. Ltd,1,1,"United Grain Growers, Ltd..... Home Grain Co., Ltd"
Federal Grain Co. Ltd..... N. Bawlf Grain Co. Ltd..... British America Elevator Co. Ltd..... The United Grain Growers Ltd..... The Alberta Pacific Grain Co. Ltd,1,1,"Federal Grain Co., Ltd..... N. Bawlf Grain Co., Ltd..... British America Elevator Co., Ltd..... The United Grain Growers, Ltd..... The Alberta Pacific Grain Co., Ltd"
N. Bawlf Grain Co. Ltd..... D. R. Davis Grain Co. Ltd..... United Grain Growers Ltd..... The Alberta Pacific Grain Co. Ltd..... Brooks Elevator Co. Ltd,1,1,"N. Bawlf Grain Co., Ltd..... D. R. Davis Grain Co., Ltd..... United Grain Growers, Ltd..... The Alberta Pacific Grain Co., Ltd..... Brooks Elevator Co., Ltd"
Pioneer Grain Co. Ltd..... United Grain Growers Ltd..... National Elevator Co. Ltd,1,1,"Pioneer Grain Co., Ltd..... United Grain Growers, Ltd..... National Elevator Co., Ltd"
Federal Grain Co. Ltd..... United Grain Growers Ltd..... The Alberta Pacific Grain Co. Ltd..... Liberty Grain Co. Ltd,1,1,"Federal Grain Co., Ltd..... United Grain Growers, Ltd..... The Alberta Pacific Grain Co., Ltd..... Liberty Grain Co., Ltd"
Northern Elevator Co. Ltd..... United Grain Growers Ltd..... Gillespie Grain Co. Ltd..... Security Elevator Co. Ltd,1,1,"Northern Elevator Co., Ltd..... United Grain Growers, Ltd..... Gillespie Grain Co., Ltd..... Security Elevator Co., Ltd"
Federal Grain Co. Ltd..... British America Elevator Co. Ltd..... United Grain Growers Ltd..... The Alberta Pacific Grain Co. Ltd..... Liberty Grain Co. Ltd,1,1,"Federal Grain Co., Ltd..... British America Elevator Co., Ltd..... United Grain Growers, Ltd..... The Alberta Pacific Grain Co., Ltd..... Liberty Grain Co., Ltd"
United Grain Growers Ltd..... The Alberta Pacific Grain Co. Ltd,1,1,"United Grain Growers, Ltd..... The Alberta Pacific Grain Co., Ltd"
Φ Alberta Pool Elevators Ltd,1,1,"Φ Alberta Pool Elevators, Ltd"
†The Goderich Elev. & Transit Co. Ltd... †Western Canada Flour Mills Co. Ltd,1,1,"†The Goderich Elev. & Transit Co., Ltd... †Western Canada Flour Mills Co., Ltd"
✓ *†Montreal Harbour Commissioners No. 2,1,1,✓ *†Montreal Harbour Commissioners No. 2
✓ *†Montreal Harbour Commissioners No. 3,1,1,✓ *†Montreal Harbour Commissioners No. 3
"✓ *†Montreal Harbour Commissioners ""B",1,1,"✓ *†Montreal Harbour Commissioners ""B"""
A. Renaurt,1,1,*A. Renaurt
A Forsythe & Co,1,1,A Forsythe & Co
Mfg. E. The Canada Malting Co. Ltd,1,1,"Mfg. E. The Canada Malting Co., Ltd"
Mfg. E. The Canada Paint Co. Ltd,1,1,"Mfg. E. The Canada Paint Co., Ltd"
Ruthenian Farmers Elevators Co. Ltd,1,1,"Ruthenian Farmers Elevators Co., Ltd"
E.S. (The Canadian Elevator Co. Ltd.),1,1,"E.S. (The Canadian Elevator Co., Ltd.)"
T. H. Lytle,1,1,T. H. Lytle
Arcola Flour Mills Ltd,1,1,"Arcola Flour Mills, Ltd"
Leonard Short,1,1,Leonard Short
Ogilvie Flour Mills Co. Ltd),1,1,"The Ogilvie Flour Mills Co., Ltd)"
Maple Creek Lt. Pr. & Mlg. Co. Ltd,1,1,"Maple Creek Lt., Pr. & Mlg. Co., Ltd"
Northern Elevator Co. Ltd..... The Ogilvie Flour Mills Co. Ltd,1,1,"The Northern Elevator Co., Ltd..... The Ogilvie Flour Mills Co., Ltd"
Saskatchewan Pool Elevators Ltd..... International Elevator Co. Ltd..... The Matheson Lindsay Grain Co. Ltd..... North Star Grain Co. Ltd,1,1,"Saskatchewan Pool Elevators, Ltd..... International Elevator Co., Ltd..... The Matheson Lindsay Grain Co., Ltd..... North Star Grain Co., Ltd"
Saskatchewan Pool Elevators Ltd..... Federal Grain Co. Ltd,1,1,"Saskatchewan Pool Elevators, Ltd..... Federal Grain Co., Ltd"
N. Bawlf Grain Co. Ltd..... The Northern Elevator Co. Ltd,1,1,"The N. Bawlf Grain Co., Ltd..... The Northern Elevator Co., Ltd"
Saskatchewan Pool Elevators Ltd..... Province Elevator Co. Ltd,1,1,"Saskatchewan Pool Elevators, Ltd..... Province Elevator Co., Ltd"
Saskatchewan Pool Elevators Ltd..... International Elevator Co. Ltd..... The Western Elevator Co. Ltd..... The Dominion Elevator Co. Ltd,1,1,"Saskatchewan Pool Elevators, Ltd..... International Elevator Co., Ltd..... The Western Elevator Co., Ltd..... The Dominion Elevator Co., Ltd"
Oxbow Frs. Elevator & Trading Co. Ltd..... W. O. Fraser,1,1,"Oxbow Frs. Elevator & Trading Co., Ltd..... W. O. Fraser"
Saskatchewan Pool Elevators Ltd..... Saskatchewan & Western Grain Co. Ltd..... Central Grain Co. Ltd..... State Elevator Co. Ltd,1,1,"Saskatchewan Pool Elevators, Ltd..... Saskatchewan & Western Grain Co., Ltd..... Central Grain Co., Ltd..... State Elevator Co., Ltd"
Saskatchewan Pool Elevators Ltd..... Province Elevator Co. Ltd..... International Elevator Co. Ltd..... *The Ogilvie Flour Mills Co. Ltd,1,1,"Saskatchewan Pool Elevators, Ltd..... Province Elevator Co., Ltd..... International Elevator Co., Ltd..... *The Ogilvie Flour Mills Co., Ltd"
N. M. Paterson & Co. Ltd..... Saskatchewan Pool Elevators Ltd..... Central Grain Co. Ltd,1,1,"N. M. Paterson & Co., Ltd..... Saskatchewan Pool Elevators, Ltd..... Central Grain Co., Ltd"
Saskatchewan Pool Elevators Ltd..... The Matheson Lindsay Grain Co. Ltd,1,1,"Saskatchewan Pool Elevators, Ltd..... The Matheson Lindsay Grain Co., Ltd"
Saskatchewan Pool Elevators Ltd..... Pioneer Grain Co. Ltd..... The Topper Grain Co. Ltd..... The Beaver Elevator Co. Ltd..... The State Elevator Co. Ltd,1,1,"Saskatchewan Pool Elevators, Ltd..... Pioneer Grain Co., Ltd..... The Topper Grain Co., Ltd..... The Beaver Elevator Co., Ltd..... The State Elevator Co., Ltd"
Ogivilie Flour Mills Co. Ltd,1,1,"Ogivilie Flour Mills Co., Ltd"
Shaunavon Lt. Pr. & Mlg. Co. Ltd,1,1,"Shaunavon Lt., Pr. & Mlg. Co., Ltd"
"Saskatchewan Pool Elevators Ltd. ""East",1,1,"Saskatchewan Pool Elevators, Ltd. ""East"""
"Saskatchewan Pool Elevators Ltd. ""West",1,1,"Saskatchewan Pool Elevators, Ltd. ""West"""
Pigeon & Newsom,1,1,Pigeon & Newsom
W. A. McHugh Elevator,1,1,W. A. McHugh Elevator
Lake of the Woods Miling Co. Ltd,1,1,"Lake of the Woods Miling Co., Ltd"
Munro-Fowler Ltd. No. 1,1,1,"The Munro-Fowler, Ltd., No. 1"
Munro-Fowler Ltd. No. 2,1,1,"*The Munro-Fowler, Ltd., No. 2"
Scottish Co-op. Whsle. Soc. Ltd..... Saskatchewan Pool Elevators Ltd,1,1,"The Scottish Co-op. Whsle. Soc., Ltd..... Saskatchewan Pool Elevators, Ltd"
Saskatchewan Pool Elevators Ltd..... Security Elevator Co. Ltd,1,1,"Saskatchewan Pool Elevators, Ltd..... Security Elevator Co., Ltd"
Saskatchewan Pool Elevators Ltd..... North Star Grain Co. Ltd..... Province Elevator Co. Ltd..... The Topper Grain Co. Ltd,1,1,"Saskatchewan Pool Elevators, Ltd..... North Star Grain Co., Ltd..... Province Elevator Co., Ltd..... The Topper Grain Co., Ltd"
Saskatchewan Pool Elevators Ltd..... The Dwyer Elevator Co. Ltd..... The State Elevator Co. Ltd..... Province Elevator Co. Ltd..... The Canadian Elevator Co. Ltd,1,1,"Saskatchewan Pool Elevators, Ltd..... The Dwyer Elevator Co., Ltd..... The State Elevator Co., Ltd..... Province Elevator Co., Ltd..... The Canadian Elevator Co., Ltd"
Security Elevator Co. Ltd..... Saskatchewan Pool Elevators Ltd..... Standard Elevator Co. Ltd,1,1,"Security Elevator Co., Ltd..... Saskatchewan Pool Elevators, Ltd..... Standard Elevator Co., Ltd"
North Star Grain Co. Ltd..... The Dominion Elevator Co. Ltd..... Saskatchewan Pool Elevators Ltd..... The Alberta Pacific Grain Co. Ltd,1,1,"North Star Grain Co., Ltd..... The Dominion Elevator Co., Ltd..... Saskatchewan Pool Elevators, Ltd..... The Alberta Pacific Grain Co., Ltd"
Province Elev. Co. Ltd..... The McLaughlin Elevator Co. Ltd,1,1,"Province Elev. Co., Ltd..... The McLaughlin Elevator Co., Ltd"
Saskatchewan Pool Elevators Ltd..... The Canadian Elevator Co. Ltd..... Stewart Grain Co. Ltd,1,1,"Saskatchewan Pool Elevators, Ltd..... The Canadian Elevator Co., Ltd..... Stewart Grain Co., Ltd"
Liberty Grain Co. Ltd..... Searle Grain Co. Ltd..... National Elevator Co. Ltd..... The Brooks Elevator Co. Ltd..... Saskatchewan Pool Elevators Ltd,1,1,"Liberty Grain Co., Ltd..... Searle Grain Co., Ltd..... National Elevator Co., Ltd..... The Brooks Elevator Co., Ltd..... Saskatchewan Pool Elevators, Ltd"
Brooksby Elevator Co. (A. Dunn),1,1,Brooksby Elevator Co. (A. Dunn)
Canora Mill Elevator (I. Bogoch),1,1,Canora Mill Elevator (I. Bogoch)
Lake of the Woods Milling. Co. Ltd,1,1,"Lake of the Woods Milling. Co., Ltd"
Mfg. E. Crown Feed & Grain Co,1,1,Mfg. E. Crown Feed & Grain Company
Mfg. E. Canada Malting Co. Ltd,1,1,"Mfg. E. Canada Malting Co., Ltd"
Gadsby Frs.' Elevator Co. Ltd,1,1,"Gadsby Frs.' Elevator Co., Ltd"
E. A. Mantz Elevator Co. Ltd,1,1,"E. A. Mantz Elevator Co., Ltd"
★ Krause Milling Co (W. A. Krause),1,1,★ Krause Milling Company (W. A. Krause)
★ United Grain Growers Ltd,1,1,"★ United Grain Growers, Ltd"
★ The Quaker Oats Co,1,1,★ The Quaker Oats Company
★ The Alberta Pacific Grain Co. Ltd,1,1,"★ The Alberta Pacific Grain Co., Ltd"
★ National Elevator Co. Ltd,1,1,"★ National Elevator Co., Ltd"
Ellison Mfg. & Elevator Co. Ltd,1,1,"Ellison Mfg. & Elevator Co., Ltd"
Blades Bros,1,1,Blades Bros
Minett & Phillipps,1,1,Minett & Phillipps
†Alberta Pool Elevators,1,1,†Alberta Pool Elevators
A. E. Sage,1,1,*A. E. Sage
Ogilvie Flour Mills Co. Ltd. (Mfg.),1,1,"The Ogilvie Flour Mills Co., Ltd. (Mfg.)"
Canadian Co-op. Wheat Prod. Ltd. No. 3,1,1,"Canadian Co-op. Wheat Prod., Ltd., No. 3"
†The Northwestern Elevator Co. Ltd,1,1,"†The Northwestern Elevator Co., Ltd"
Grain Growers Export Co. Ltd,1,1,"Grain Growers Export Co., Ltd"
Jas. Davidson & Co. Ltd,1,1,"Jas. Davidson & Co., Ltd"
Thunder Bay Term. Elevator Co. Ltd,1,1,"Thunder Bay Term. Elevator Co., Ltd"
†Reliance Term. Elevator Co. Ltd,1,1,"†Reliance Term. Elevator Co., Ltd"
†The Bawlf Term. Elevator Co. Ltd,1,1,"†The Bawlf Term. Elevator Co., Ltd"
Canadian Co-op. Wheat Prod. Ltd. No. 1,1,1,"Canadian Co-op. Wheat Prod., Ltd., No. 1"
†Eastern Term. Elevator Co. Ltd,1,1,"†Eastern Term. Elevator Co., Ltd"
†Saskatchewan Pool Elevators Ltd. No. 5,1,1,"†Saskatchewan Pool Elevators, Ltd., No. 5"
†Grain Growers Export Co. Ltd,1,1,"†Grain Growers Export Co., Ltd"
Canadian Co-op. Wheat Prod. Ltd. No. 2,1,1,"Canadian Co-op. Wheat Prod., Ltd., No. 2"
†N. M. Paterson & Co. Ltd,1,1,"*†N. M. Paterson & Co., Ltd"
†Manitoba Co-op. Wheat Prod. Ltd,1,1,"†Manitoba Co-op. Wheat Prod., Ltd"
†Columbia Grain Co. Ltd,1,1,"†Columbia Grain Co., Ltd"
Malden Term. Elevator Co. Ltd,1,1,"Malden Term. Elevator Co., Ltd"
Robert MacInnes & Co. Ltd,1,1,"Robert MacInnes & Co., Ltd"
Consumers Elevator Co. Ltd,1,1,"Consumers Elevator Co., Ltd"
"Western Canada Fl. Mills Co. Ltd. ""A",1,1,"Western Canada Fl. Mills Co., Ltd. ""A"""
"Western Canada Fl. Mills Co. Ltd. ""B",1,1,"Western Canada Fl. Mills Co., Ltd. ""B"""
Alberta Pac. Grain Co. Ltd,1,1,"The Alberta Pac. Grain Co., Ltd"
Spillers Canadian Mlg. Co. Ltd,1,1,"Spillers Canadian Mlg. Co., Ltd"
West. Can. F. Mills Co. Ltd,1,1,"West. Can. F. Mills Co., Ltd"
Hedley Shaw Mlg. Co. Ltd,1,1,"Hedley Shaw Mlg. Co., Ltd"
†The Brackman-Ker Mlg. Co. Ltd,1,1,"†The Brackman-Ker Mlg. Co., Ltd"
Westminster Grain Co. (G. Elliott),1,1,Westminster Grain Co. (G. Elliott)
†Vernon & Bucknerfield Ltd,1,1,"†Vernon & Bucknerfield, Ltd"
Vancouver Mlg. & Grain Co. Ltd,1,1,"Vancouver Mlg. & Grain Co., Ltd"
Columbia Elevator Co. (J. Whittle),1,1,Columbia Elevator Co. (J. Whittle)
B.C.E. McLellan & McCarter Ltd,1,1,"B.C.E. McLellan & McCarter, Ltd"
G.N. *Vernon & Bucknerfield Ltd,1,1,"G.N. *Vernon & Bucknerfield, Ltd"
Grand Trunk Pacific El. Co. Ltd,1,1,"Grand Trunk Pacific El. Co., Ltd"
†Sask. Pool Elevators Ltd. No. 4,1,1,"†Sask. Pool Elevators, Ltd. No. 4"
Sask. Pool Elevators Ltd. No. 6,1,1,"Sask. Pool Elevators, Ltd. No. 6"
N. M. Peterson & Co. Ltd,1,1,"N. M. Peterson & Co., Ltd"
United Grain Growers Ltd..... N. M. Paterson & Co. Ltd..... Province Elevator Co. Ltd,1,1,"United Grain Growers, Ltd..... N. M. Paterson & Co., Ltd..... Province Elevator Co., Ltd"
Ogilvie Flour Mills Co. Ltd..... Maple Leaf Milling Co. Ltd..... Manitoba Pool Elevators Ltd,1,1,"*The Ogilvie Flour Mills Co., Ltd..... Maple Leaf Milling Co., Ltd..... Manitoba Pool Elevators, Ltd"
Province Elevator Co. Ltd..... United Grain Growers Ltd,1,1,"Province Elevator Co., Ltd..... United Grain Growers, Ltd"
Manitoba Pool Elevators Ltd..... Western Canada Flour Mills Co. Ltd,1,1,"Manitoba Pool Elevators, Ltd..... Western Canada Flour Mills Co., Ltd"
United Grain Growers Ltd..... N. M. Paterson & Co. Ltd..... Manitoba Pool Elevators Ltd,1,1,"United Grain Growers, Ltd..... N. M. Paterson & Co., Ltd..... Manitoba Pool Elevators, Ltd"
Canadian Consolidated Grain Co. Ltd... N. M. Paterson & Co. Ltd,1,1,"The Canadian Consolidated Grain Co., Ltd... N. M. Paterson & Co., Ltd"
N. M. Paterson & Co. Ltd..... Manitoba Pool Elevators Ltd..... International Elevator Co. Ltd,1,1,"N. M. Paterson & Co., Ltd..... Manitoba Pool Elevators, Ltd..... International Elevator Co., Ltd"
